{
  "id": "10",
  "name": "German Bundesliga",
  "abbreviation": "Bundesliga",
  "children": [
    {
      "id": "1",
      "name": "2024-25 German Bundesliga",
      "abbreviation": "2024-25",
      "standings": {
        "season": 2024,
        "seasonType": 1,
        "entries": [
          {
            "note": {
              "color": "#81D6AC",
              "description": "Champions League",
              "rank": 1
            },
            "team": {
              "isNational": false,
              "id": "132",
              "uid": "s:600~t:132",
              "location": "Bayern Munich",
              "name": "Bayern Munich",
              "abbreviation": "MUN",
              "displayName": "Bayern Munich",
              "shortDisplayName": "Bayern",
              "isActive": true,
              "logos": [
                {
                  "lastUpdated": "2022-07-27T14:42Z",
                  "href": "https://a.espncdn.com/i/teamlogos/soccer/500/132.png",
                  "width": 500,
                  "height": 500,
                  "alt": "",
                  "rel": [
                    "full",
                    "default"
                  ]
                }
              ],
              "links": [
                {
                  "language": "en-US",
                  "shortText": "Clubhouse",
                  "href": "https://www.espn.com/soccer/club/_/id/132/bayern-munich",
                  "text": "Clubhouse",
                  "rel": [
                    "clubhouse",
                    "desktop",
                    "team"
                  ],
                  "isExternal": false,
                  "isPremium": false
                }
              ]
            },
            "stats": [
              {
                "name": "gamesPlayed",
                "type": "gamesplayed",
                "displayName": "Games Played",
                "shortDisplayName": "GP",
                "description": "Games Played",
                "abbreviation": "GP",
                "value": 34.0,
                "displayValue": "34"
              },
              {
                "name": "losses",
                "type": "losses",
                "displayName": "Losses",
                "shortDisplayName": "L",
                "description": "Losses",
                "abbreviation": "L",
                "value": 2.0,
                "displayValue": "2"
              },
              {
                "name": "pointDifferential",
                "type": "pointdifferential",
                "displayName": "Goal Difference",
                "shortDisplayName": "GD",
                "description": "Goal Difference",
                "abbreviation": "GD",
                "value": 67.0,
                "displayValue": "+67"
              },
              {
                "name": "points",
                "type": "points",
                "displayName": "Points",
                "shortDisplayName": "P",
                "description": "Points",
                "abbreviation": "P",
                "value": 82.0,
                "displayValue": "82"
              },
              {
                "name": "pointsAgainst",
                "type": "pointsagainst",
                "displayName": "Goals Against",
                "shortDisplayName": "A",
                "description": "Goals Against",
                "abbreviation": "A",
                "value": 32.0,
                "displayValue": "32"
              },
              {
                "name": "pointsFor",
                "type": "pointsfor",
                "displayName": "Goals For",
                "shortDisplayName": "F",
                "description": "Goals For",
                "abbreviation": "F",
                "value": 99.0,
                "displayValue": "99"
              },
              {
                "name": "ties",
                "type": "ties",
                "displayName": "Draws",
                "shortDisplayName": "D",
                "description": "Draws",
                "abbreviation": "D",
                "value": 7.0,
                "displayValue": "7"
              },
              {
                "name": "wins",
                "type": "wins",
                "displayName": "Wins",
                "shortDisplayName": "W",
                "description": "Wins",
                "abbreviation": "W",
                "value": 25.0,
                "displayValue": "25"
              },
              {
                "name": "deductions",
                "type": "deductions",
                "displayName": "Point Deductions",
                "shortDisplayName": "Deductions",
                "description": "Point Deductions",
                "abbreviation": "PD",
                "value": 0.0,
                "displayValue": ""
              },
              {
                "name": "ppg",
                "type": "ppg",
                "displayName": "Points Per Game",
                "shortDisplayName": "PPG",
                "description": "Points Per Game",
                "abbreviation": "PPG",
                "value": 0.0,
                "displayValue": "0"
              },
              {
                "name": "rank",
                "type": "rank",
                "displayName": "Rank",
                "shortDisplayName": "Rank",
                "description": "Rank",
                "abbreviation": "R",
                "value": 1.0,
                "displayValue": "1"
              },
              {
                "name": "rankChange",
                "type": "rankchange",
                "displayName": "Rank Change",
                "shortDisplayName": "Rank Change",
                "description": "Rank Change",
                "abbreviation": "RC",
                "value": 0.0,
                "displayValue": "0"
              },
              {
                "id": "0",
                "summary": "25-7-2",
                "name": "overall",
                "type": "total",
                "displayName": "Overall",
                "shortDisplayName": "OVER",
                "description": "Overall Record",
                "abbreviation": "Total",
                "displayValue": "25-7-2"
              }
            ]
          },
          {
            "note": {
              "color": "#81D6AC",
              "description": "Champions League",
              "rank": 2
            },
            "team": {
              "isNational": false,
              "id": "131",
              "uid": "s:600~t:131",
              "location": "Bayer Leverkusen",
              "name": "Bayer Leverkusen",
              "abbreviation": "B04",
              "displayName": "Bayer Leverkusen",
              "shortDisplayName": "Leverkusen",
              "isActive": true,
              "logos": [
                {
                  "lastUpdated": "2024-01-04T17:49Z",
                  "href": "https://a.espncdn.com/i/teamlogos/soccer/500/131.png",
                  "width": 500,
                  "height": 500,
                  "alt": "",
                  "rel": [
                    "full",
                    "default"
                  ]
                }
              ],
              "links": [
                {
                  "language": "en-US",
                  "shortText": "Clubhouse",
                  "href": "https://www.espn.com/soccer/club/_/id/131/bayer-leverkusen",
                  "text": "Clubhouse",
                  "rel": [
                    "clubhouse",
                    "desktop",
                    "team"
                  ],
                  "isExternal": false,
                  "isPremium": false
                }
              ]
            },
            "stats": [
              {
                "name": "gamesPlayed",
                "type": "gamesplayed",
                "displayName": "Games Played",
                "shortDisplayName": "GP",
                "description": "Games Played",
                "abbreviation": "GP",
                "value": 34.0,
                "displayValue": "34"
              },
              {
                "name": "losses",
                "type": "losses",
                "displayName": "Losses",
                "shortDisplayName": "L",
                "description": "Losses",
                "abbreviation": "L",
                "value": 3.0,
                "displayValue": "3"
              },
              {
                "name": "pointDifferential",
                "type": "pointdifferential",
                "displayName": "Goal Difference",
                "shortDisplayName": "GD",
                "description": "Goal Difference",
                "abbreviation": "GD",
                "value": 29.0,
                "displayValue": "+29"
              },
              {
                "name": "points",
                "type": "points",
                "displayName": "Points",
                "shortDisplayName": "P",
                "description": "Points",
                "abbreviation": "P",
                "value": 69.0,
                "displayValue": "69"
              },
              {
                "name": "pointsAgainst",
                "type": "pointsagainst",
                "displayName": "Goals Against",
                "shortDisplayName": "A",
                "description": "Goals Against",
                "abbreviation": "A",
                "value": 43.0,
                "displayValue": "43"
              },
              {
                "name": "pointsFor",
                "type": "pointsfor",
                "displayName": "Goals For",
                "shortDisplayName": "F",
                "description": "Goals For",
                "abbreviation": "F",
                "value": 72.0,
                "displayValue": "72"
              },
              {
                "name": "ties",
                "type": "ties",
                "displayName": "Draws",
                "shortDisplayName": "D",